{
  "authority_status": "awaiting_genuinely_independent_annotation",
  "claim_boundary": "Fresh label-blind source items only; this packet is not annotation evidence and does not authorize training or inference.",
  "frozen_at_utc": "2026-08-10T21:36:37Z",
  "instructions": {
    "cannot_assess_fails_confirmatory_eligibility": true,
    "direct_identifiers_prohibited": true,
    "distinct_adjudicator_required": true,
    "external_provenance_audit_required": true,
    "judgement_fields": [
      "semantic_similarity_high",
      "structural_match",
      "roles_preserved",
      "typed_relations_preserved",
      "invariant_preserved",
      "boundary_matched",
      "qoi_matched",
      "directional_mapping_complete",
      "transfer_valid"
    ],
    "required_independent_submissions_per_item": 2
  },
  "items": [
    {
      "candidate_load_bearing_boundary": "Finite-capacity network or graph representation with an additive cut objective and explicit terminals.",
      "candidate_load_bearing_invariant": "A separating cut bounds any feasible source-to-sink throughput, and a minimum admissible cut identifies the tight capacity certificate.",
      "family": "bottleneck_min_cut",
      "item_id": "p3item-6dabfe1fb311a2300189",
      "qoi": "Can the source cut certificate be reused to characterize the target optimum?",
      "source_dependencies": [
        "directed network",
        "edge capacities",
        "source and sink"
      ],
      "source_domain": "rail capacity networks",
      "source_evidence": [
        "DOI:10.4153/CJM-1956-045-5 | Ford and Fulkerson (1956), Maximal Flow Through a Network | https://doi.org/10.4153/CJM-1956-045-5"
      ],
      "source_skill_tags": [
        "maximum flow",
        "capacity constraint"
      ],
      "source_surface_terms": [
        "rail",
        "capacity",
        "cities",
        "flow"
      ],
      "target_dependencies": [
        "pixel graph",
        "pairwise penalties",
        "terminal labels"
      ],
      "target_domain": "image labelling",
      "target_evidence": [
        "DOI:10.1109/34.969114 | Boykov, Veksler and Zabih (2001), Fast approximate energy minimization via graph cuts | https://doi.org/10.1109/34.969114"
      ],
      "target_skill_tags": [
        "graph cut",
        "energy minimization"
      ],
      "target_surface_terms": [
        "pixels",
        "labels",
        "energy",
        "cut"
      ]
    },
    {
      "candidate_load_bearing_boundary": "Steady or discretized flow with fixed edge capacities; congestion dynamics and behavioral feedback must be outside the claimed QoI.",
      "candidate_load_bearing_invariant": "A separating cut bounds the maximum simultaneous throughput between registered origins and exits.",
      "family": "bottleneck_min_cut",
      "item_id": "p3item-0151ebbf6feb4c731a68",
      "qoi": "Does the source bottleneck certificate bound evacuation throughput under the target model?",
      "source_dependencies": [
        "directed network",
        "edge capacities",
        "source and sink"
      ],
      "source_domain": "rail capacity networks",
      "source_evidence": [
        "DOI:10.4153/CJM-1956-045-5 | Ford and Fulkerson (1956), Maximal Flow Through a Network | https://doi.org/10.4153/CJM-1956-045-5"
      ],
      "source_skill_tags": [
        "maximum flow",
        "capacity constraint"
      ],
      "source_surface_terms": [
        "rail",
        "capacity",
        "cities",
        "flow"
      ],
      "target_dependencies": [
        "space graph",
        "door capacities",
        "origins and exits"
      ],
      "target_domain": "building evacuation",
      "target_evidence": [
        "DOI:10.1007/978-3-030-04651-4_16 | Min-Max-Flow Based Algorithm for Evacuation Network Planning in Restricted Spaces | https://doi.org/10.1007/978-3-030-04651-4_16"
      ],
      "target_skill_tags": [
        "evacuation planning",
        "route capacity"
      ],
      "target_surface_terms": [
        "rooms",
        "exits",
        "evacuees",
        "routes"
      ]
    },
    {
      "candidate_load_bearing_boundary": "Capacitated network abstraction with compatible conservation assumptions and without unmodelled substitution or inventory dynamics.",
      "candidate_load_bearing_invariant": "End-to-end throughput cannot exceed the capacity of a separating bottleneck set.",
      "family": "bottleneck_min_cut",
      "item_id": "p3item-8d8f2f1e9714b658a592",
      "qoi": "Can the supply-chain bottleneck object certify rail-network throughput?",
      "source_dependencies": [
        "multi-echelon network",
        "random or fixed capacities"
      ],
      "source_domain": "supply chain networks",
      "source_evidence": [
        "DOI:10.1080/00207543.2012.695878 | Bottleneck identification in supply chain networks | https://doi.org/10.1080/00207543.2012.695878"
      ],
      "source_skill_tags": [
        "bottleneck identification",
        "supply network"
      ],
      "source_surface_terms": [
        "suppliers",
        "plants",
        "inventory",
        "bottleneck"
      ],
      "target_dependencies": [
        "directed network",
        "edge capacities",
        "source and sink"
      ],
      "target_domain": "rail capacity networks",
      "target_evidence": [
        "DOI:10.4153/CJM-1956-045-5 | Ford and Fulkerson (1956), Maximal Flow Through a Network | https://doi.org/10.4153/CJM-1956-045-5"
      ],
      "target_skill_tags": [
        "maximum flow",
        "capacity constraint"
      ],
      "target_surface_terms": [
        "rail",
        "capacity",
        "cities",
        "flow"
      ]
    },
    {
      "candidate_load_bearing_boundary": "Target objective may include higher-order or non-submodular terms that violate the graph-cut construction assumptions.",
      "candidate_load_bearing_invariant": "A minimum cut is an exact or bounded optimizer only when the target energy admits the required graph-representable form.",
      "family": "bottleneck_min_cut",
      "item_id": "p3item-b31fb5883b05a197f550",
      "qoi": "Does the source graph-cut certificate remain licensed for the target image objective?",
      "source_dependencies": [
        "pairwise penalties",
        "terminal labels"
      ],
      "source_domain": "image labelling",
      "source_evidence": [
        "DOI:10.1109/34.969114 | Boykov, Veksler and Zabih (2001), Fast approximate energy minimization via graph cuts | https://doi.org/10.1109/34.969114"
      ],
      "source_skill_tags": [
        "graph cut",
        "energy minimization"
      ],
      "source_surface_terms": [
        "pixels",
        "labels",
        "energy",
        "cut"
      ],
      "target_dependencies": [
        "higher-order nonlocal constraints",
        "no guaranteed cut representation"
      ],
      "target_domain": "image labelling",
      "target_evidence": [
        "DOI:10.1109/34.969114 | Boykov, Veksler and Zabih (2001), Fast approximate energy minimization via graph cuts | https://doi.org/10.1109/34.969114"
      ],
      "target_skill_tags": [
        "non-submodular labelling",
        "global topology"
      ],
      "target_surface_terms": [
        "pixels",
        "labels",
        "nonlocal loss",
        "topology"
      ]
    },
    {
      "candidate_load_bearing_boundary": "Preferences or priorities and capacities are fixed for the run; stability is the QoI rather than welfare or truthfulness in an altered mechanism.",
      "candidate_load_bearing_invariant": "Deferred acceptance yields a stable assignment relative to the registered preference and priority relation.",
      "family": "matching_allocation",
      "item_id": "p3item-d201c820070f26f974c9",
      "qoi": "Can the source stability argument certify absence of blocking pairs in the target assignment?",
      "source_dependencies": [
        "two-sided preferences",
        "blocking pairs"
      ],
      "source_domain": "two-sided marriage matching",
      "source_evidence": [
        "DOI:10.1080/00029890.1962.11989827 | Gale and Shapley (1962), College Admissions and the Stability of Marriage | https://doi.org/10.1080/00029890.1962.11989827"
      ],
      "source_skill_tags": [
        "stable matching",
        "deferred acceptance"
      ],
      "source_surface_terms": [
        "men",
        "women",
        "marriage",
        "preferences"
      ],
      "target_dependencies": [
        "student preferences",
        "school priorities",
        "capacities"
      ],
      "target_domain": "public high-school assignment",
      "target_evidence": [
        "DOI:10.1257/000282805774670167 | Abdulkadiroglu, Pathak and Roth (2005), The New York City High School Match | https://doi.org/10.1257/000282805774670167"
      ],
      "target_skill_tags": [
        "school assignment",
        "deferred acceptance"
      ],
      "target_surface_terms": [
        "students",
        "schools",
        "priorities",
        "choices"
      ]
    },
    {
      "candidate_load_bearing_boundary": "The target algorithm, capacities, couples constraints and preference semantics must match the stability theorem actually invoked.",
      "candidate_load_bearing_invariant": "The assignment is stable when no admissible applicant-program pair blocks it under the registered priorities.",
      "family": "matching_allocation",
      "item_id": "p3item-e2bf0d479a2a70cf576e",
      "qoi": "Does the school-assignment stability object transfer to the registered residency mechanism?",
      "source_dependencies": [
        "student preferences",
        "school priorities",
        "capacities"
      ],
      "source_domain": "public high-school assignment",
      "source_evidence": [
        "DOI:10.1257/000282805774670167 | Abdulkadiroglu, Pathak and Roth (2005), The New York City High School Match | https://doi.org/10.1257/000282805774670167"
      ],
      "source_skill_tags": [